{"title":"Why a Submitted Form Can Still Lose a Lead","description":"Draft for human review. A fictional, visual walkthrough of a safer web-form workflow; it contains no client metrics or claimed results.","hook":"The form says “Submitted.” So why is there no lead?","language":"en","target_duration_sec":35,"fact_check_required":false,"scenes":[{"index":0,"duration_sec":4,"voiceover":"The form says “Submitted.” So why is there no lead?","subtitle":"Submitted—but no lead?","visual_type":"motion_graphic","visual_prompt":"Vertical 9:16 motion graphic of a generic web form changing to a green Submitted state, followed by an empty lead inbox. Add a persistent small label: FICTIONAL DEMO. No brands, logos, analytics, or real customer data.","stock_query":null,"transition":"cut"},{"index":1,"duration_sec":5,"voiceover":"In this fictional demo, success appears before the server confirms storage.","subtitle":"Success appeared too early","visual_type":"motion_graphic","visual_prompt":"Vertical 9:16 fictional system diagram. Animate Browser to Server to Lead Store. Show the success checkmark appearing while the Server-to-Lead-Store connection is still pending. Label the interface FICTIONAL DEMO.","stock_query":null,"transition":"zoom"},{"index":2,"duration_sec":5,"voiceover":"Then a notification fails. The visitor leaves, while the team sees nothing.","subtitle":"The notification fails","visual_type":"motion_graphic","visual_prompt":"Vertical 9:16 animation: notification branch turns red with a clear Failed label, visitor icon exits, and the team inbox remains empty. Keep FICTIONAL DEMO visible. Use only generic icons.","stock_query":null,"transition":"cut"},{"index":3,"duration_sec":6,"voiceover":"Use a safer sequence: validate on the server, then save the lead first.","subtitle":"Validate → Save first","visual_type":"motion_graphic","visual_prompt":"Vertical 9:16 step diagram with large numbered blocks: 1 Server validation, 2 Save lead. Animate a green confirmation moving through both steps in order. Mark as RECOMMENDED PATTERN and FICTIONAL DEMO.","stock_query":null,"transition":"slide"},{"index":4,"duration_sec":5,"voiceover":"In this pattern, repeat submissions with one request ID become one request.","subtitle":"One ID, one request","visual_type":"motion_graphic","visual_prompt":"Vertical 9:16 diagram showing two retry arrows carrying the same fictional request ID into a single request record. Do not display code, personal data, or real identifiers. Label FICTIONAL DEMO.","stock_query":null,"transition":"cut"},{"index":5,"duration_sec":5,"voiceover":"After storage succeeds, show confirmation. Run notifications as retryable follow-up tasks.","subtitle":"Save → Confirm → Notify","visual_type":"motion_graphic","visual_prompt":"Vertical 9:16 ordered flow: Lead Stored gets a green check, then Visitor Confirmation, then a separate Notification Queue with a retry arrow. Use large readable labels and a FICTIONAL DEMO tag.","stock_query":null,"transition":"slide"},{"index":6,"duration_sec":5,"voiceover":"Log each step and flag failures. Map this path before your next launch.","subtitle":"Log, flag, review","visual_type":"text_card","visual_prompt":"Vertical 9:16 closing card with a simple checklist: Validate, Save, Confirm, Notify, Log. Highlight Map the full path. Add Draft for human review and FICTIONAL DEMO in small but readable text.","stock_query":null,"transition":"fade"}],"cta":"Map your form’s full path—from Submit to stored lead—before your next launch.","source_notes":[{"claim":"The failure sequence shown in the video is a fictional demonstration, not a client case or reported result.","source_url":null,"source_title":null,"verification_status":"not_applicable","note":"Provided evidence defines the example as a fictional demonstration built in Content Factory."},{"claim":"The validate, save, confirm, notify, and log sequence is presented as a workflow design recommendation.","source_url":null,"source_title":null,"verification_status":"not_applicable","note":"No performance statistics, guarantees, client outcomes, or external factual claims are included. Draft for human review."}]}